{"$id":"https://orbital-dynamics.local/schemas/realized_activity.v1.schema.json","$schema":"https://json-schema.org/draft/2020-12/schema","additionalProperties":true,"allOf":[{"if":{"anyOf":[{"required":["provider"]},{"required":["adapter"]},{"required":["adapter_version"]},{"required":["external_id"]}]},"then":{"anyOf":[{"required":["trust_boundary"]},{"properties":{"provenance":{"additionalProperties":true,"properties":{"trust_boundary":{"type":"string"}},"required":["trust_boundary"],"type":"object"}},"required":["provenance"]}],"required":["external_id"]}}],"properties":{"ground_station_id":{"pattern":"^[A-Za-z0-9][A-Za-z0-9._:@-]*$","type":"string"},"pointing_status":{"type":"string"},"payload_id":{"pattern":"^[A-Za-z0-9][A-Za-z0-9._:@-]*$","type":"string"},"observation_success":{"type":"boolean"},"attitude_mode":{"type":"string"},"symbol_lock":{"type":"boolean"},"metadata":{"type":"object"},"eclipse_overlap_s":{"type":"number"},"thermal_zone_id":{"pattern":"^[A-Za-z0-9][A-Za-z0-9._:@-]*$","type":"string"},"delivered_rate_mb_s":{"type":"number"},"station":{"additionalProperties":true,"properties":{"ground_station_id":{"pattern":"^[A-Za-z0-9][A-Za-z0-9._:@-]*$","type":"string"},"id":{"pattern":"^[A-Za-z0-9][A-Za-z0-9._:@-]*$","type":"string"},"station_id":{"pattern":"^[A-Za-z0-9][A-Za-z0-9._:@-]*$","type":"string"}},"type":"object"},"execution_uncertainty_status":{"type":"string"},"resource_trust_boundary_status":{"type":"string"},"spacecraft_available":{"type":"boolean"},"observation_success_factor_source":{"type":"string"},"image_quality_source":{"type":"string"},"trust_boundary":{"type":"string"},"thermal_confidence":{"maximum":1.0,"minimum":0.0,"type":"number"},"lighting_confidence":{"type":["number","string"]},"link_quality_status":{"type":"string"},"slew_angle_deg":{"type":"number"},"product_id":{"pattern":"^[A-Za-z0-9][A-Za-z0-9._:@-]*$","type":"string"},"delta_v_magnitude_km_s":{"type":"number"},"reason":{"type":"string"},"attitude_target_id":{"pattern":"^[A-Za-z0-9][A-Za-z0-9._:@-]*$","type":"string"},"delta_v_3sigma_km_s":{"items":{"type":"number"},"maxItems":3,"minItems":3,"type":"array"},"received_at":{"type":"string"},"contact_duration_s":{"type":"number"},"feedback_weight":{"type":"number"},"attitude_error_deg":{"type":"number"},"actual_starts_at_s":{"type":"number"},"actual_delivery_at_s":{"type":"number"},"actual_data_volume_mb":{"type":"number"},"product_ids":{"items":{"pattern":"^[A-Za-z0-9][A-Za-z0-9._:@-]*$","type":"string"},"type":"array"},"source_quality":{"type":"string"},"planned_delivery_at_s":{"type":"number"},"satellite_id":{"pattern":"^[A-Za-z0-9][A-Za-z0-9._:@-]*$","type":"string"},"actual_data_rate_mb_s":{"type":"number"},"target_priority":{"type":"number"},"yaw_deg":{"type":"number"},"maneuver_execution_uncertainty":{"additionalProperties":true,"properties":{"delta_v_3sigma_km_s":{"items":{"type":"number"},"maxItems":3,"minItems":3,"type":"array"},"delta_v_3sigma_magnitude_km_s":{"type":"number"},"model":{"type":"string"},"source":{"type":"string"},"timing_3sigma_s":{"type":"number"}},"type":"object"},"collection_ends_at_s":{"type":"number"},"planned_activity_id":{"pattern":"^[A-Za-z0-9][A-Za-z0-9._:@-]*$","type":"string"},"command_authority_status":{"type":"string"},"command_success":{"type":"boolean"},"roll_deg":{"type":"number"},"received_rate_mb_s":{"type":"number"},"quality":{"type":"string"},"external_id":{"pattern":"^[A-Za-z0-9][A-Za-z0-9._:@-]*$","type":"string"},"data_rate_mbps":{"type":"number"},"timing_3sigma_s":{"type":"number"},"boresight_axis":{"type":"string"},"estimated_storage_mb":{"type":"number"},"battery_capacity_wh":{"minimum":0.0,"type":"number"},"command_authorized":{"type":"boolean"},"snr_db":{"type":"number"},"schema_contract":{"const":"realized_activity.v1","description":"Stable executable contract identifier","type":"string"},"spacecraft_id":{"pattern":"^[A-Za-z0-9][A-Za-z0-9._:@-]*$","type":"string"},"contact_success_factor_source":{"type":"string"},"actual_latency_s":{"type":"number"},"modulation":{"type":"string"},"activity_type":{"type":"string"},"maneuver_success_factor_source":{"type":"string"},"station_id":{"pattern":"^[A-Za-z0-9][A-Za-z0-9._:@-]*$","type":"string"},"pointing_model":{"type":"string"},"min_operating_temperature_c":{"type":"number"},"planned_temperature_c":{"type":"number"},"actual_ends_at_s":{"type":"number"},"data_rate_mb_s":{"type":"number"},"resource_trust_boundary":{"type":"string"},"provider":{"type":"string"},"payload_available":{"type":"boolean"},"contact_result":{"type":"string"},"maneuver_success":{"type":"boolean"},"collection_id":{"pattern":"^[A-Za-z0-9][A-Za-z0-9._:@-]*$","type":"string"},"feedback_status":{"type":"string"},"actual_downlink_rate_mbps":{"type":"number"},"antenna_available":{"type":"boolean"},"completed_fraction":{"maximum":1.0,"minimum":0.0,"type":"number"},"ground_station":{"additionalProperties":true,"properties":{"ground_station_id":{"pattern":"^[A-Za-z0-9][A-Za-z0-9._:@-]*$","type":"string"},"id":{"pattern":"^[A-Za-z0-9][A-Za-z0-9._:@-]*$","type":"string"},"station_id":{"pattern":"^[A-Za-z0-9][A-Za-z0-9._:@-]*$","type":"string"}},"type":"object"},"fuel_margin":{"maximum":1.0,"minimum":0.0,"type":"number"},"delta_v_km_s":{"items":{"type":"number"},"maxItems":3,"minItems":3,"type":"array"},"planned_latency_s":{"type":"number"},"target":{"additionalProperties":true,"properties":{"id":{"pattern":"^[A-Za-z0-9][A-Za-z0-9._:@-]*$","type":"string"},"target_id":{"pattern":"^[A-Za-z0-9][A-Za-z0-9._:@-]*$","type":"string"}},"type":"object"},"pointing_confidence":{"maximum":1.0,"minimum":0.0,"type":"number"},"id":{"pattern":"^[A-Za-z0-9][A-Za-z0-9._:@-]*$","type":"string"},"lighting_condition_model":{"type":"string"},"required_downlink_mb":{"type":"number"},"ingested_at":{"type":"string"},"incompatible_activity_types":{"items":{"type":"string"},"type":"array"},"resource_blocking_dimension":{"type":"string"},"adapter":{"type":"string"},"polarization":{"type":"string"},"contact_success_factor":{"maximum":1.0,"minimum":0.0,"type":"number"},"actual_contact_duration_s":{"type":"number"},"pointing_target_id":{"pattern":"^[A-Za-z0-9][A-Za-z0-9._:@-]*$","type":"string"},"suppressed_activity_types":{"items":{"type":"string"},"type":"array"},"maneuver_success_factor":{"maximum":1.0,"minimum":0.0,"type":"number"},"status":{"enum":["completed","executed","partial","missed","failed","delayed","canceled","cancelled","rejected"],"type":"string"},"lighting_detail_model":{"type":"string"},"adapter_version":{"type":"string"},"max_operating_temperature_c":{"type":"number"},"actual_delta_v_km_s":{"items":{"type":"number"},"maxItems":3,"minItems":3,"type":"array"},"thermal_status":{"type":"string"},"provenance":{"type":"object"},"link_protocol":{"type":"string"},"link_margin_db":{"type":"number"},"attitude_status":{"type":"string"},"resource_source_quality":{"type":"string"},"actual_temperature_c":{"type":"number"},"frequency_band":{"type":"string"},"contact_success":{"type":"boolean"},"downlink_margin":{"maximum":1.0,"minimum":0.0,"type":"number"},"observation_result":{"type":"string"},"maneuver_result":{"type":"string"},"battery_energy_generated_wh":{"minimum":0.0,"type":"number"},"lighting_condition":{"type":"string"},"pitch_deg":{"type":"number"},"downlink_rate_mbps":{"type":"number"},"pointing_mode":{"type":"string"},"observation_success_factor":{"maximum":1.0,"minimum":0.0,"type":"number"},"battery_state_of_charge":{"maximum":1.0,"minimum":0.0,"type":"number"},"image_quality_score":{"maximum":1.0,"minimum":0.0,"type":"number"},"thermal_source":{"type":"string"},"source":{"type":"object"},"direction":{"type":"string"},"battery_energy_used_wh":{"minimum":0.0,"type":"number"},"realized_status":{"enum":["completed","executed","partial","missed","failed","delayed","canceled","cancelled","rejected"],"type":"string"},"executed_delta_v_km_s":{"items":{"type":"number"},"maxItems":3,"minItems":3,"type":"array"},"spacecraft":{"additionalProperties":true,"properties":{"id":{"pattern":"^[A-Za-z0-9][A-Za-z0-9._:@-]*$","type":"string"},"satellite_id":{"pattern":"^[A-Za-z0-9][A-Za-z0-9._:@-]*$","type":"string"},"spacecraft_id":{"pattern":"^[A-Za-z0-9][A-Za-z0-9._:@-]*$","type":"string"}},"type":"object"},"degraded":{"type":"boolean"},"off_nadir_angle_deg":{"type":"number"},"received_rate_mbps":{"type":"number"},"actual_duration_s":{"type":"number"},"storage_margin":{"maximum":1.0,"minimum":0.0,"type":"number"},"command_success_factor_source":{"type":"string"},"actual_downlink_rate_mb_s":{"type":"number"},"attitude_source":{"type":"string"},"eb_no_db":{"type":"number"},"blur_score":{"maximum":1.0,"minimum":0.0,"type":"number"},"actual_throughput_mb":{"type":"number"},"image_quality_status":{"type":"string"},"execution_uncertainty_source":{"type":"string"},"frame_loss_rate":{"maximum":1.0,"minimum":0.0,"type":"number"},"cloud_cover_fraction":{"maximum":1.0,"minimum":0.0,"type":"number"},"execution_uncertainty":{"additionalProperties":true,"properties":{"delta_v_3sigma_km_s":{"items":{"type":"number"},"maxItems":3,"minItems":3,"type":"array"},"delta_v_3sigma_magnitude_km_s":{"type":"number"},"model":{"type":"string"},"source":{"type":"string"},"timing_3sigma_s":{"type":"number"}},"type":"object"},"command_safety_checked":{"type":"boolean"},"delivered_rate_mbps":{"type":"number"},"packet_loss_rate":{"maximum":1.0,"minimum":0.0,"type":"number"},"command_success_factor":{"maximum":1.0,"minimum":0.0,"type":"number"},"carrier_lock":{"type":"boolean"},"satellite":{"additionalProperties":true,"properties":{"id":{"pattern":"^[A-Za-z0-9][A-Za-z0-9._:@-]*$","type":"string"},"satellite_id":{"pattern":"^[A-Za-z0-9][A-Za-z0-9._:@-]*$","type":"string"},"spacecraft_id":{"pattern":"^[A-Za-z0-9][A-Za-z0-9._:@-]*$","type":"string"}},"type":"object"},"type":{"type":"string"},"estimated_downlink_mb":{"type":"number"},"temperature_c":{"type":"number"},"estimated_data_volume_mb":{"type":"number"},"command_safety_status":{"type":"string"},"pointing_source":{"type":"string"},"required_authority":{"type":"string"},"planned_estimated_throughput_mb":{"type":"number"},"power_margin":{"maximum":1.0,"minimum":0.0,"type":"number"},"source_window_id":{"pattern":"^[A-Za-z0-9][A-Za-z0-9._:@-]*$","type":"string"},"resource_id":{"pattern":"^[A-Za-z0-9][A-Za-z0-9._:@-]*$","type":"string"},"downlink_rate_mb_s":{"type":"number"},"actual_data_rate_mbps":{"type":"number"},"delta_v_3sigma_magnitude_km_s":{"type":"number"},"data_volume_mb":{"type":"number"},"target_id":{"pattern":"^[A-Za-z0-9][A-Za-z0-9._:@-]*$","type":"string"},"mode":{"type":"string"},"timeline_id":{"pattern":"^[A-Za-z0-9][A-Za-z0-9._:@-]*$","type":"string"},"lighting_condition_detail":{"type":"string"},"resource_provenance":{"type":"object"},"feedback_weight_source":{"type":"string"},"command_result":{"type":"string"},"slew_rate_deg_s":{"type":"number"},"attitude_confidence":{"maximum":1.0,"minimum":0.0,"type":"number"},"thermal_margin_c":{"type":"number"},"pointing_error_deg":{"type":"number"},"bit_error_rate":{"maximum":1.0,"minimum":0.0,"type":"number"},"attitude_model":{"type":"string"},"thermal_model":{"type":"string"},"coding_scheme":{"type":"string"},"max_latency_s":{"type":"number"},"eclipse_overlap_fraction":{"maximum":1.0,"minimum":0.0,"type":"number"},"instrument_id":{"pattern":"^[A-Za-z0-9][A-Za-z0-9._:@-]*$","type":"string"},"planned_data_volume_mb":{"type":"number"}},"required":["schema_contract","id","status"],"title":"OrbitalDynamics realized_activity.v1","type":"object","x-orbital-dynamics":{"artifact_family":"realized_activity","compatibility_policy":{"breaking_change_action":"mint a new schema_contract name or increment the artifact schema_version before publishing","breaking_changes":["remove_required_fields","change_required_field_type","change_schema_contract_identifier","change_schema_version_const","change_required_field_semantics"],"compatible_changes":["add_optional_fields","add_optional_nested_contracts","tighten_executable_semantic_validation_without_changing_exported_required_fields"],"policy_version":1,"validation_mode":"top_level_compatibility_export"},"compatibility_policy_version":1,"executable_contract":true,"identity_policy":{"breaking_changes":["change_existing_public_identifier_for_the_same_semantic_entity","emit_blank_identifier","emit_identifier_with_whitespace"],"compatible_changes":["add_optional_identifier_fields","add_more_specific_semantic_source_metadata_without_changing_existing_ids"],"description":"Public artifact identifiers are non-empty machine identifiers without whitespace.","generated_id_scopes":[{"identity_fields":["scenario_id","type","source_window_id","target_id","ground_station_id"],"ordering":["result_event_type","scenario_id","source_window_id","starts_at_s"],"scope":"candidate_refresh.v1.candidate_activities"},{"generated_id_field":"id","identity_fields":["type","scenario_id","target_id","ground_station_id","starts_at_s","ends_at_s"],"ordering":["type","scenario_id","target_id","ground_station_id","starts_at_s","id"],"scope":"candidate_refresh.v1.refreshed_windows.generated_window_id","semantic_invariants":["source_record_order_must_not_change_generated_window_id","canonical_source_event_sort_key_must_drive_window_index","same_semantic_source_window_must_keep_generated_window_id"]},{"identity_fields":["spacecraft_id","scenario_id","epoch.seconds_since_j2000"],"ordering":["spacecraft_id","scenario_id","epoch.seconds_since_j2000"],"scope":"accepted_planning_state.v1.spacecraft_states"},{"generated_id_field":"id","identity_fields":["resource_scope","ground_station_id","spacecraft_id","starts_at_s","ends_at_s","contact_ids"],"ordering":["resource_scope","ground_station_id","spacecraft_id","starts_at_s","id"],"scope":"contact_contention_report.v1.conflict_groups.generated_group_id","semantic_invariants":["source_record_order_must_not_change_generated_group_id","canonical_contact_sort_key_must_drive_conflict_group_index","same_semantic_contention_group_must_keep_generated_group_id"]},{"generated_id_field":"group_id","identity_fields":["group_id","resource_scope","ground_station_id","spacecraft_id","starts_at_s","selected_contact_id","deferred_contact_ids"],"ordering":["resource_scope","ground_station_id","spacecraft_id","starts_at_s","group_id"],"scope":"contact_contention_resolution_report.v1.recommendations.generated_group_id","semantic_invariants":["contention_group_id_must_flow_to_recommendation_group_id","source_record_order_must_not_change_recommendation_group_id","resolution_ordering_must_not_change_group_identity"]},{"explicit_id_fields":["route_id","id","data_path_id"],"identity_fields":["source_spacecraft_id","relay_chain_spacecraft_ids","ground_station_id","ground_downlink_contact_id","latency_s","latency_limit_s","product_ids","collection_ids"],"ordering":["source_spacecraft_id","ground_downlink_contact_id","semantic_route_fingerprint"],"scope":"relay_data_path_summary.v1.rows.generated_route_id","semantic_invariants":["source_record_order_must_not_change_generated_route_id","semantic_route_evidence_changes_must_change_generated_route_id","explicit_route_id_takes_precedence_over_generated_route_id"]},{"generated_id_field":"publication_id","identity_fields":["publication_sequence","source_artifact_id","supersedes_artifact_ids"],"ordering":["publication_sequence","source_artifact_id","supersedes_artifact_ids"],"scope":"timeline_publication_summary.v1.publication_id","semantic_invariants":["source_record_order_must_not_change_publication_id","same_publication_sequence_and_artifact_lineage_must_keep_publication_id","publication_id_serializes_declared_artifact_lineage"]}],"policy_version":1,"semantic_invariants":["source_record_order_must_not_change_generated_identity","semantic_source_identity_must_remain_stable_across_manifest_export","scenario_and_activity_identity_must_not_depend_on_wall_clock_time"],"stable_id_pattern":"^[A-Za-z0-9][A-Za-z0-9._:@-]*$"},"identity_policy_version":1,"nested_contract_definition_scope":"direct_declared_contracts","nested_contracts":[],"schema_contract":"realized_activity.v1","schema_version":1,"validation_mode":"top_level_compatibility_export"}}
