{
  "schema_contract": "realized_activity.v1",
  "id": "downlink_equator",
  "planned_activity_id": "downlink_equator",
  "timeline_id": "timeline:downlink:equator_prime:access:leo_1:equator_prime:1",
  "status": "partial",
  "actual_starts_at_s": 102.0,
  "actual_ends_at_s": 150.0,
  "completed_fraction": 0.6,
  "reason": "provider reported reduced throughput",
  "type": "downlink",
  "direction": "downlink",
  "ground_station_id": "equator_prime",
  "source_window_id": "window:leo_1:ground_station_access:equator_prime:1",
  "resource_id": "payload_power_bus",
  "resource_source_quality": "declared",
  "resource_trust_boundary": "operator_supplied",
  "resource_trust_boundary_status": "declared",
  "resource_provenance": {
    "source": "cadence_execution_feedback"
  },
  "resource_blocking_dimension": "power",
  "fuel_margin": 0.7,
  "power_margin": 0.15,
  "storage_margin": 0.05,
  "downlink_margin": 0.6,
  "battery_capacity_wh": 1200.0,
  "battery_energy_used_wh": 900.0,
  "battery_state_of_charge": 0.15,
  "spacecraft_available": true,
  "payload_available": false,
  "antenna_available": false,
  "degraded": true,
  "mode": "reduced_power",
  "incompatible_activity_types": [
    "downlink"
  ],
  "suppressed_activity_types": [
    "observe"
  ],
  "collection_id": "collection_alpha",
  "product_id": "image_alpha_1",
  "product_ids": [
    "image_alpha_1",
    "image_alpha_2"
  ],
  "payload_id": "payload_camera",
  "instrument_id": "narrow_angle_camera",
  "data_volume_mb": 80.0,
  "planned_data_volume_mb": 80.0,
  "actual_data_volume_mb": 60.0,
  "estimated_data_volume_mb": 80.0,
  "estimated_storage_mb": 80.0,
  "estimated_downlink_mb": 72.0,
  "required_downlink_mb": 72.0,
  "collection_ends_at_s": 360.0,
  "planned_delivery_at_s": 540.0,
  "actual_delivery_at_s": 570.0,
  "max_latency_s": 240.0,
  "planned_latency_s": 180.0,
  "actual_latency_s": 210.0,
  "planned_estimated_throughput_mb": 72.0,
  "target_priority": 4.0,
  "contact_result": "dropped",
  "contact_success_factor": 0.25,
  "contact_success_factor_source": "provider_contact_quality",
  "command_success_factor": 1.0,
  "command_success_factor_source": "provider_command_acceptance",
  "observation_success": false,
  "observation_result": "clouded",
  "observation_success_factor": 0.0,
  "observation_success_factor_source": "provider_observation_result",
  "maneuver_success": false,
  "maneuver_result": "underburn",
  "maneuver_success_factor": 0.4,
  "maneuver_success_factor_source": "provider_maneuver_reconstruction",
  "feedback_weight": 3.0,
  "feedback_weight_source": "provider_sample_count",
  "delta_v_km_s": [
    0.0,
    0.008,
    0.0
  ],
  "actual_delta_v_km_s": [
    0.0,
    0.008,
    0.0
  ],
  "executed_delta_v_km_s": [
    0.0,
    0.008,
    0.0
  ],
  "delta_v_magnitude_km_s": 0.008,
  "execution_uncertainty": {
    "timing_3sigma_s": 5.0,
    "delta_v_3sigma_km_s": [
      0.0,
      0.001,
      0.0
    ],
    "source": "provider_execution_covariance"
  },
  "execution_uncertainty_status": "declared",
  "timing_3sigma_s": 5.0,
  "delta_v_3sigma_km_s": [
    0.0,
    0.001,
    0.0
  ],
  "delta_v_3sigma_magnitude_km_s": 0.001,
  "execution_uncertainty_source": "provider_execution_covariance",
  "pointing_mode": "earth_track",
  "pointing_target_id": "equator_prime",
  "boresight_axis": "+Z",
  "off_nadir_angle_deg": 4.5,
  "slew_angle_deg": 1.0,
  "slew_rate_deg_s": 0.1,
  "pointing_error_deg": 0.04,
  "pointing_status": "verified",
  "pointing_model": "provider_feedback",
  "pointing_source": "cadence_execution_feedback",
  "pointing_confidence": 0.9,
  "attitude_mode": "earth_track",
  "attitude_target_id": "equator_prime",
  "roll_deg": 0.25,
  "pitch_deg": -0.1,
  "yaw_deg": 0.5,
  "attitude_error_deg": 0.08,
  "attitude_status": "verified",
  "attitude_model": "provider_feedback",
  "attitude_source": "cadence_execution_feedback",
  "attitude_confidence": 0.92,
  "thermal_zone_id": "payload_deck",
  "temperature_c": 42.0,
  "planned_temperature_c": 18.0,
  "actual_temperature_c": 42.0,
  "min_operating_temperature_c": -5.0,
  "max_operating_temperature_c": 45.0,
  "thermal_margin_c": 3.0,
  "thermal_status": "near_limit",
  "thermal_model": "provider_feedback",
  "thermal_source": "cadence_execution_feedback",
  "thermal_confidence": 0.8,
  "eclipse_overlap_fraction": 0.35,
  "eclipse_overlap_s": 21.0,
  "lighting_condition": "penumbra",
  "lighting_condition_detail": "partial_eclipse",
  "lighting_condition_model": "provider_lighting_replay",
  "lighting_detail_model": "provider_lighting_replay",
  "lighting_confidence": 0.72,
  "link_protocol": "space_packet",
  "frequency_band": "x_band",
  "modulation": "qpsk",
  "coding_scheme": "ldpc",
  "polarization": "rhcp",
  "data_rate_mbps": 8.0,
  "link_margin_db": -1.5,
  "snr_db": 2.0,
  "eb_no_db": 0.5,
  "bit_error_rate": 0.02,
  "packet_loss_rate": 0.25,
  "frame_loss_rate": 0.1,
  "carrier_lock": false,
  "symbol_lock": false,
  "link_quality_status": "low_margin",
  "actual_throughput_mb": 72.0,
  "contact_success": false,
  "provider": "cadence",
  "adapter": "cadence_feedback_adapter",
  "adapter_version": "2026.05",
  "external_id": "provider-feedback-1",
  "trust_boundary": "operator_supplied",
  "received_at": "2026-05-14T00:05:00Z",
  "ingested_at": "2026-05-14T00:05:02Z",
  "source": {
    "system": "cadence_execution_feedback",
    "source_id": "provider-feedback-1"
  },
  "provenance": {
    "trust_boundary": "operator_supplied"
  },
  "metadata": {
    "source": "cadence_execution_feedback",
    "planned_activity_id": "downlink_equator",
    "planned_timeline_id": "timeline:downlink:equator_prime:access:leo_1:equator_prime:1",
    "feedback_boundary": "artifact_only_no_schedule_mutation"
  }
}
